adult,backdrop_path,genre_ids,id,original_language,original_title,overview,popularity,poster_path,release_date,title,video,vote_average,vote_count
False,/be5SIsRGMckO8tU9lrLcIik70Dy.jpg,"[27, 14, 10749]",1246049,fr,Dracula,"거장 뤽 베송이 선사하는 전설의 화려한 부활, 그 태초의 이야기. 15세기, 신을 위해 칼을 들고 전장을 누비던 왕자 '블라드'. 하지만 신은 그의 헌신에 대한 대가로 가장 사랑하는 여인을 죽음으로 몰아넣는다. 찢어질 듯한 슬픔과 배신감에 사로잡힌 그는 십자가를 부수고 신을 저주하며, 영원히 죽지 못하는 어둠의 길을 선택한다. 피를 마시며 영겁의 시간을 견뎌온 괴물, 드라큘라. 세기를 넘어 다시금 그에게 운명처럼 찾아온 사랑의 흔적은 그를 광기와 열망의 소용돌이로 몰아넣는다. ""내 사랑을 앗아간 신에게 복수하고, 영원 속에서 당신을 다시 찾으리라."" 칸 영화제 남우주연상 수상자 케일럽 랜드리 존스와 크리스토프 왈츠의 압도적인 연기, 그리고 뤽 베송 감독 특유의 미학적인 비주얼이 만나 탄생한 고딕 판타지. 공포를 넘어선 비극적이고도 아름다운 핏빛 서사시가 당신의 심장을 조여온다. 괴물이 될 수밖에 없었던 한 남자의 처절한 사랑, 그 거대한 비극의 막이 오른다.",31.1197,/hCKkybW6EfSZoOW3xia9ZsQwaUd.jpg,2025-07-30,드라큘라: 어 러브 테일,False,7.123,898
False,/n36zycrAqHn2uzx65IeAdnsZcMj.jpg,"[35, 18]",1159206,en,Father Mother Sister Brother,"미국 북동부, 아일랜드 더블린, 프랑스 파리. 거리만큼 관계도 멀어진 세 가족의 오랜만의 만남을 섬세하고 우아하게 담은 작품.",30.3569,/jid3LHJM91QdHrYFtghsJDLg2HM.jpg,2025-12-01,파더 마더 시스터 브라더,False,6.6,160
False,/4w6nQYAY0eb7B0VVRDXilXcgAUV.jpg,"[80, 27, 9648]",4232,en,Scream,"작은 소도시 우즈버러에 사는 케이시에게 이상한 남자로부터 전화가 걸려온다. 비디오를 보려는 케이시에게 그 남자는 케이시의 남자 친구인 스티브의 목숨을 걸고 게임을 하자고 한다. 케이시가 문제를 맞추면 살고, 틀리면 남자친구가 죽는다. 문제는 '13일의 금요일'에 나오는 살인마의 이름을 맞추는 것. 케이시는 문제를 풀지 못하고, 스티브는 처참하게 죽임을 당한다. 이튿날, 혼자 집에 있는 시드니에게도 이상한 전화가 걸려온다. 시드니는 케이시와는 달리 힘들게 괴전화의 마수에서 빠져 나온다. 그러나 시드니의 남자 친구 빌리가 살인 용의자로 체포되는데, 조사 후 무혐의로 풀려난다.",33.7602,/fvprcRjlvrgok1rvOJN4NY8Uqba.jpg,1996-12-20,스크림,False,7.4,7731
